{
  "id": "b2c3d4e5-f6a7-8901-bcde-f12345678901",
  "definitionKey": "community-enquiry",
  "displayName": "Get in Touch",
  "version": 1,
  "description": "Simple contact workflow for community enquiries.",
  "schemaVersion": "1.0",
  "initialTouchpointKey": "collecting-details",
  "requestPolicy": "single",
  "queues": [
    {
      "key": "applicant",
      "title": "Applicant",
      "actor": "applicant",
      "roleGates": []
    }
  ],
  "gateways": [
    {
      "key": "route-submitted",
      "title": "Route to submitted",
      "type": "Split",
      "queueKey": "applicant",
      "source": "collecting-details",
      "roleGates": [],
      "routes": [
        {
          "id": "collecting-details--submit--submitted",
          "target": "submitted",
          "trigger": "submit",
          "actions": []
        }
      ]
    }
  ],
  "touchpoints": [
    {
      "key": "collecting-details",
      "title": "Your details",
      "type": "Question",
      "queueKey": "applicant",
      "actions": [],
      "roleGates": [],
      "components": []
    },
    {
      "key": "submitted",
      "title": "Thank you",
      "type": "Confirmation",
      "queueKey": "applicant",
      "actions": [],
      "roleGates": [],
      "components": []
    }
  ]
}
